{
  "$schema": "../scene.schema.json",
  "scene_id": "intro-welcome",
  "section_id": "hook",
  "order": 0,
  "type": "intro",
  "content": {
    "text": "Tired of juggling multiple tools to manage your projects?",
    "image": "assets/intro-background.png",
    "duration_ms": 5000,
    "title": "MyApp",
    "subtitle": "All-in-One Project Management"
  },
  "direction": {
    "transition": {
      "in": "fade",
      "out": "fade",
      "duration_ms": 500
    },
    "emphasis": {
      "effect": "glitch",
      "timing": "2s"
    },
    "background": {
      "type": "gradient",
      "value": "linear-gradient(135deg, #667eea 0%, #764ba2 100%)",
      "opacity": 0.9
    },
    "camera": {
      "movement": "zoom",
      "start": {
        "scale": 1.2
      },
      "end": {
        "scale": 1.0
      }
    }
  },
  "assets": [
    {
      "type": "image",
      "source": "assets/intro-background.png",
      "generated": true,
      "metadata": {
        "width": 1920,
        "height": 1080,
        "format": "png"
      }
    },
    {
      "type": "image",
      "source": "public/logo.svg",
      "generated": false,
      "metadata": {
        "format": "svg"
      }
    }
  ],
  "audio": {
    "narration": {
      "text": "Are you tired of juggling multiple tools just to manage your projects?",
      "file": "audio/narration/intro-01.mp3",
      "start_offset_ms": 1000
    },
    "sfx": [
      {
        "file": "audio/sfx/whoosh.mp3",
        "timing_ms": 500,
        "volume": 0.5
      }
    ]
  },
  "template": "intro",
  "notes": "Opening hook with glitch effect to grab attention. Narration starts 1 second after scene begins."
}
